<?xml version="1.0" encoding="UTF-8"?>
<!-- Resultat de l'appel https://www.url.com/webSerivice.php 
    avec les parametres en POST suivant:
    usr = 'user.login'
    pwd = 'password'
    op  = 'listePersonnes'
    param0= 'sciences_Technologies'  // Nom du campus.Si il n'est pas envoyé, ça veut dire tout les campus
-->
<response xmlns:xsi="http://www.w3.org/2001/XMLSchema-instance"
    xsi:noNamespaceSchemaLocation="schemaListePersonne.xsd">  
    <status>0</status>
    <usrGroup>2</usrGroup>
    <personnes>
        <personne  id="1" nom="Nom 1" prenom="Prénom 1" tel="07420000" email="test@usj.edu.lb" type="0" >
            <description value="Professeurs de Maths de l'usj"/>
            <img adresse="http://google.ch/img1.jpg"/>
        </personne>
        <personne  id="2" nom="Professeur 2" prenom="Prénom 2" email="test2@usj.edu.lb" type="0" >
            <description value="Professeurs ou collaborateur de l'usj 2"/>
        </personne>
        <personne  id="3" nom="Etudiant " prenom="Prénom 2" email="test2@usj.edu.lb" type="1" >
            <description value="Etudiant de l'usj 2"/>
        </personne>
        <personne  id="4" nom="Etudiant2 " prenom="Prénom 2" email="test2@usj.edu.lb" type="1" >
            <description value="Etudiant 2 de l'usj 2"/>
        </personne>
    </personnes>
</response>
